<?xml version="1.0" encoding="utf-8"?>
<!-- Created with Liquid Technologies Online Tools 1.0 (https://www.liquid-technologies.com) -->
<E-form xmlns="http://schemas.gov.sk/doc/eform/00603481.dopravneZnacenie.sk/0.2" xsi:schemaLocation="http://schemas.gov.sk/doc/eform/00603481.dopravneZnacenie.sk/0.2 schema.xsd" xmlns:xsi="http://www.w3.org/2001/XMLSchema-instance">
  <Meta>
    <ID>string</ID>
    <Name>string</Name>
    <Description>string</Description>
    <Gestor>string</Gestor>
    <RecipientId>string</RecipientId>
    <Version>string</Version>
    <ZepRequired>false</ZepRequired>
    <EformUuid>string</EformUuid>
    <SenderID>mailto:</SenderID>
  </Meta>
  <Body>
    <ZiatetelTyp>true</ZiatetelTyp>
    <Splnomocnenie>
      <Nazov>string</Nazov>
      <Prilozena>true</Prilozena>
    </Splnomocnenie>
    <Splnomocnenie>
      <Nazov>string</Nazov>
      <Prilozena>true</Prilozena>
    </Splnomocnenie>
    <Splnomocnenie>
      <Nazov>string</Nazov>
      <Prilozena>0</Prilozena>
    </Splnomocnenie>
    <Nazov>string</Nazov>
    <Sidlo>string</Sidlo>
    <Mesto>
      <Code>string</Code>
      <Name>string</Name>
      <WsEnumCode>string</WsEnumCode>
    </Mesto>
    <Psc>string</Psc>
    <Ico>string</Ico>
    <Banka>string</Banka>
    <Iban>string</Iban>
    <MenoPriezvisko>string</MenoPriezvisko>
    <Email>string</Email>
    <Telefon>009</Telefon>
    <TypStanovistaUpresnenie>Nahradenie existujúceho stanovišťa</TypStanovistaUpresnenie>
    <MestomPonukanaDokumentacia>0</MestomPonukanaDokumentacia>
    <PopisZbernychNadob>string</PopisZbernychNadob>
    <VegetacnaStrecha>true</VegetacnaStrecha>
    <VegetacnaStena>true</VegetacnaStena>
    <SadoveUpravy>false</SadoveUpravy>
    <Kataster>string</Kataster>
    <Kataster>string</Kataster>
    <Parcela>
      <Code>string</Code>
      <Name>string</Name>
      <WsEnumCode>string</WsEnumCode>
    </Parcela>
    <AdresaUmiestnenia>string</AdresaUmiestnenia>
    <AdresaUmiestnenia>string</AdresaUmiestnenia>
    <Velkost>3435</Velkost>
    <Zaujem>Dotáciu na kontajnerové stojisko</Zaujem>
  </Body>
</E-form>
